CursoID,Tags
1,"aprendizaje, red, inteligencia, aplicaci贸n, concepto"
2,"comunicaci贸n red, arquitectura red, red seguridad, red, computadora, estudio, protocolo, seguridad"
3,"algebra, dato estructura, grafo, ciencia, computacion, conjunto"
4,"sistema, recurso, concurrencia, multitarea, administracion, concepto, gestion, proceso"
5,"modelo, administracion, base, dato, relacional"
6,"engineering, programacion, desarrollo metodologia, desarrollo herramienta, desarrollo, metodologia, practica, software"
7,"criptografia, seguridad, funci贸n hash, algoritmo, cifrado, curso, funci贸n, hash, principio"
8,"optimizacion, programacion, algoritmo, curso, problema, resultado, tecnica"
